"Link","Classe","Número","Ano.de.autuação","Relator.Atual","Data","Andamento","Observação.Andamento","Ramo.do.direito","Assuntos","fator_m_aurelio","unanimidade"
"Rcl-11323","Rcl",11323,2011,"MIN. ROSA WEBER","22/4/2015","Agravo regimental provido","Decisão: O Tribunal, por maioria, deu provimento ao agravo regimental e julgou procedente a reclamação, vencidos os Ministros Rosa Weber (Relatora), Marco Aurélio e Celso de Mello. Redigirá o acórdão o Ministro Teori Zavascki. O Ministro Luiz Fux retificou a proclamação da assentada anterior para fazer constar que deu provimento ao agravo regimental. Ausente, justificadamente, o Ministro Roberto Barroso, que representa o Tribunal na ""Brazil Conference"", na Universidade de Harvard, e na ""Brazilian Undergraduate Student Conference"", na Universidade de Columbia, Estados Unidos. Presidiu o julgamento o Ministro Ricardo Lewandowski. Plenário, 22.04.2015.","DIREITO PROCESSUAL CIVIL E DO TRABALHO","1 - DIREITO PROCESSUAL CIVIL E DO TRABALHO | JURISDIÇÃO E COMPETÊNCIA | COMPETÊNCIA","0","0"
"ADI-1923","ADI",1923,1998,"MIN. AYRES BRITTO","16/4/2015","Procedente em parte","Decisão: O Tribunal, por maioria, julgou parcialmente procedente o pedido, apenas para conferir interpretação conforme à Constituição à Lei nº 9.637/98 e ao art. 24, XXIV da Lei nº 8.666/93, incluído pela Lei nº 9.648/98, para que: (i) o procedimento de qualificação seja conduzido de forma pública, objetiva e impessoal, com observância dos princípios do caput do art. 37 da Constituição Federal, e de acordo com parâmetros fixados em abstrato segundo o que prega o art. 20 da Lei nº 9.637/98; (ii) a celebração do contrato de gestão seja conduzida de forma pública, objetiva e impessoal, com observância dos princípios do caput do art. 37 da Constituição Federal;  (iii) as hipóteses de dispensa de licitação para contratações (Lei nº 8.666/93, art. 24, XXIV) e outorga de permissão de uso de bem público (Lei nº 9.637/98, art. 12, § 3º) sejam conduzidas de forma pública, objetiva e impessoal, com observância dos princípios do caput do art. 37 da Constituição Federal; (iv) os contratos a serem c","DIREITO ADMINISTRATIVO E OUTRAS MATÉRIAS DE DIREITO PÚBLICO","1 - DIREITO ADMINISTRATIVO E OUTRAS MATÉRIAS DE DIREITO PÚBLICO | GARANTIAS CONSTITUCIONAIS","0","0"
"AR-1415","AR",1415,1998,"MIN. LUIZ FUX","9/4/2015","Agravo regimental não provido","Decisão: O Tribunal, por maioria e nos termos do voto do Relator, negou provimento ao agravo regimental, vencido o Ministro Teori Zavascki. Ausentes, justificadamente, o Ministro Celso de Mello; participando do 3º Seminário luso-brasileiro, em Portugal, o Ministro Gilmar Mendes, e, neste julgamento, o Ministro Roberto Barroso. Presidiu o julgamento o Ministro Ricardo Lewandowski. Plenário, 09.04.2015.","DIREITO TRIBUTÁRIO","1 - DIREITO TRIBUTÁRIO | CONTRIBUIÇÕES | CONTRIBUIÇÕES SOCIAIS | FINSOCIAL 2 - DIREITO TRIBUTÁRIO | CRÉDITO TRIBUTÁRIO | BASE DE CÁLCULO 3 - DIREITO TRIBUTÁRIO | CRÉDITO TRIBUTÁRIO | ALÍQUOTA 4 - DIREITO TRIBUTÁRIO | CRÉDITO TRIBUTÁRIO | REPETIÇÃO DE INDÉBITO 5 - DIREITO TRIBUTÁRIO | CRÉDITO TRIBUTÁRIO | JUROS/CORREÇÃO MONETÁRIA","0","0"
"AR-1584","AR",1584,2000,"MIN. LUIZ FUX","9/4/2015","Agravo regimental não provido","Decisão: O Tribunal, por maioria e nos termos do voto do Relator, negou provimento ao agravo regimental, vencido o Ministro Teori Zavascki. Ausentes, justificadamente, o Ministro Celso de Mello; participando do 3º Seminário luso-brasileiro, em Portugal, o Ministro Gilmar Mendes, e, neste julgamento, o Ministro Roberto Barroso. Presidiu o julgamento o Ministro Ricardo Lewandowski. Plenário, 09.04.2015.","DIREITO TRIBUTÁRIO","1 - DIREITO TRIBUTÁRIO | CONTRIBUIÇÕES | CONTRIBUIÇÕES SOCIAIS 2 - DIREITO TRIBUTÁRIO | CONTRIBUIÇÕES | CONTRIBUIÇÕES SOCIAIS | PIS","0","0"
"ADI-4552","ADI",4552,2011,"MIN. CÁRMEN LÚCIA","9/4/2015","Liminar deferida","Decisão: O Tribunal, nos termos do voto da Relatora, deferiu a medida cautelar para suspender a eficácia do artigo 305, caput, e § 1º, da Constituição do Estado do Pará, vencido em parte o Ministro Dias Toffoli. Ausentes, justificadamente, o Ministro Celso de Mello e, participando do 3º Seminário luso-brasileiro de Direito, em Portugal, o Ministro Gilmar Mendes. Presidiu o julgamento o Ministro Ricardo Lewandowski. Plenário, 09.04.2015.","DIREITO ADMINISTRATIVO E OUTRAS MATÉRIAS DE DIREITO PÚBLICO","1 - DIREITO ADMINISTRATIVO E OUTRAS MATÉRIAS DE DIREITO PÚBLICO","0","0"
"PSV-109","PSV",109,2013,"MINISTRO PRESIDENTE","9/4/2015","Rejeitada proposta de edição de SV"," Decisão: Rejeitada a proposta de edição de súmula vinculante ante a manifestação dos Ministros Dias Toffoli, Marco Aurélio, Cármen Lúcia e Teori Zavascki nesse sentido. Ausentes, justificadamente, o Ministro Celso de Mello e, participando do 3º Seminário luso-brasileiro de Direito, em Portugal, o Ministro Gilmar Mendes. Presidência do Ministro Ricardo Lewandowski. Plenário, 09.04.2014.","DIREITO TRIBUTÁRIO","0 - DIREITO TRIBUTÁRIO | LIMITAÇÕES AO PODER DE TRIBUTAR | IMUNIDADE  | ENTIDADES SEM FINS LUCRATIVOS 1 - DIREITO TRIBUTÁRIO | IMPOSTOS | IRPF/IMPOSTO DE RENDA DE PESSOA FÍSICA | INCIDÊNCIA SOBRE PROVENTOS DE PREVIDÊNCIA PRIVADA","0","0"
"ADI-2949","ADI",2949,2003,"MIN. JOAQUIM BARBOSA","8/4/2015","Questão de ordem","Decisão: O Tribunal, por maioria, resolveu a questão de ordem no sentido de entender que o julgamento foi concluído na sessão do Plenário do dia 26 de setembro de 2007, não havendo a possibilidade de reabertura do julgamento após a proclamação do resultado, vencidos os Ministros Gilmar Mendes, Menezes Direito e Teori Zavascki. Não votou o Ministro Dias Toffoli, sucessor do Ministro Menezes Direito. Redigirá o acórdão o Ministro Marco Aurélio. Ausentes, justificadamente, o Ministro Celso de Mello e, participando do 3º Seminário luso-brasileiro de Direito, em Portugal, o Ministro Gilmar Mendes. Presidiu o julgamento o Ministro Ricardo Lewandowski. Plenário, 08.04.2015.","DIREITO ADMINISTRATIVO E OUTRAS MATÉRIAS DE DIREITO PÚBLICO","1 - DIREITO ADMINISTRATIVO E OUTRAS MATÉRIAS DE DIREITO PÚBLICO | CONCURSO PÚBLICO / EDITAL","0","0"
"PSV-102","PSV",102,2013,"MINISTRO PRESIDENTE","8/4/2015","Acolhida proposta de edição de SV","Decisão: O Tribunal, por maioria, mediante a conversão da Súmula nº 685, aprovou a proposta da edição da Súmula vinculante nº 43, nos seguintes termos: ""É inconstitucional toda modalidade de provimento que propicie ao servidor investir-se, sem prévia aprovação em concurso público destinado ao seu provimento, em cargo que não integra a carreira na qual anteriormente investido"", vencidos os Ministros Marco Aurélio e Cármen Lúcia apenas no que tange à redação. Ausentes, justificadamente, o Ministro Celso de Mello e, participando do 3º Seminário luso-brasileiro de Direito, em Portugal, o Ministro Gilmar Mendes. Presidiu o julgamento o Ministro Ricardo Lewandowski. Plenário, 08.04.2015.","DIREITO ADMINISTRATIVO E OUTRAS MATÉRIAS DE DIREITO PÚBLICO","0 - DIREITO ADMINISTRATIVO E OUTRAS MATÉRIAS DE DIREITO PÚBLICO | SERVIDOR PÚBLICO CIVIL | REGIME ESTATUTÁRIO | NOMEAÇÃO","0","0"
"ADI-5163","ADI",5163,2014,"MIN. LUIZ FUX","8/4/2015","Procedente","Decisão: Colhido o voto do Ministro Ricardo Lewandowski (Presidente), que acompanhou a Ministra Cármen Lúcia no sentido de que outras forças fossem convocadas de imediato, pelo Estado de Goiás, até no máximo o mês de novembro de 2015, com a nomeação dos concursados, não foi atingido o quorum para modulação dos efeitos da declaração de inconstitucionalidade. Ausentes, justificadamente, o Ministro Celso de Mello e, participando do 3º Seminário luso-brasileiro de Direito, em Portugal, o Ministro Gilmar Mendes. Plenário, 08.04.2015.","DIREITO ADMINISTRATIVO E OUTRAS MATÉRIAS DE DIREITO PÚBLICO","0 - DIREITO ADMINISTRATIVO E OUTRAS MATÉRIAS DE DIREITO PÚBLICO | CONTROLE DE CONSTITUCIONALIDADE | INCONSTITUCIONALIDADE MATERIAL","0","0"
"ADI-4357","ADI",4357,2009,"MIN. LUIZ FUX","25/3/2015","Questão de ordem","Decisão: Concluindo o julgamento, o Tribunal, por maioria e nos termos do voto, ora reajustado, do Ministro Luiz Fux (Relator), resolveu a questão de ordem nos seguintes termos: 1) - modular os efeitos para que se dê sobrevida ao regime especial de pagamento de precatórios, instituído pela Emenda Constitucional nº 62/2009, por 5 (cinco) exercícios financeiros a contar de primeiro de janeiro de 2016; 2) - conferir eficácia prospectiva à declaração de inconstitucionalidade dos seguintes aspectos da ADI, fixando como marco inicial a data de conclusão do julgamento da presente questão de ordem (25.03.2015) e mantendo-se válidos os precatórios expedidos ou pagos até esta data, a saber: 2.1.) fica mantida a aplicação do índice oficial de remuneração básica da caderneta de poupança (TR), nos termos da Emenda Constitucional nº 62/2009, até 25.03.2015, data após a qual (i) os créditos em precatórios deverão ser corrigidos pelo Índice de Preços ao Consumidor Amplo Especial (IPCA-E) e (ii) os pre","DIREITO ADMINISTRATIVO E OUTRAS MATÉRIAS DE DIREITO PÚBLICO","1 - DIREITO ADMINISTRATIVO E OUTRAS MATÉRIAS DE DIREITO PÚBLICO | CONTROLE DE CONSTITUCIONALIDADE 2 - DIREITO PROCESSUAL CIVIL E DO TRABALHO | LIQUIDAÇÃO / CUMPRIMENTO / EXECUÇÃO DE SENTENÇA | PRECATÓRIO","0","0"
"ADI-4425","ADI",4425,2010,"MIN. LUIZ FUX","25/3/2015","Questão de ordem","Decisão: Concluindo o julgamento, o Tribunal, por maioria e nos termos do voto, ora reajustado, do Ministro Luiz Fux (Relator), resolveu a questão de ordem nos seguintes termos: 1) - modular os efeitos para que se dê sobrevida ao regime especial de pagamento de precatórios, instituído pela Emenda Constitucional nº 62/2009, por 5 (cinco) exercícios financeiros a contar de primeiro de janeiro de 2016; 2) - conferir eficácia prospectiva à declaração de inconstitucionalidade dos seguintes aspectos da ADI, fixando como marco inicial a data de conclusão do julgamento da presente questão de ordem (25.03.2015) e mantendo-se válidos os precatórios expedidos ou pagos até esta data, a saber: 2.1.) fica mantida a aplicação do índice oficial de remuneração básica da caderneta de poupança (TR), nos termos da Emenda Constitucional nº 62/2009, até 25.03.2015, data após a qual (i) os créditos em precatórios deverão ser corrigidos pelo Índice de Preços ao Consumidor Amplo Especial (IPCA-E) e (ii) os pre","DIREITO PROCESSUAL CIVIL E DO TRABALHO","1 - DIREITO PROCESSUAL CIVIL E DO TRABALHO | LIQUIDAÇÃO / CUMPRIMENTO / EXECUÇÃO DE SENTENÇA | PRECATÓRIO | LIQUIDAÇÃO PARCELADA","0","0"
"MS-25763","MS",25763,2005,"MIN. LUIZ FUX","19/3/2015","Concedida a ordem","Decisão: O Tribunal, por maioria, conheceu do mandado de segurança e concedeu a ordem, vencidos os Ministros Eros Grau (Relator), Cármen Lúcia e Rosa Weber. Não votou o Ministro Luiz Fux por suceder ao Ministro Eros Grau (Relator). Impedidos os Ministros Roberto Barroso e Dias Toffoli. Redigirá o acórdão o Ministro Gilmar Mendes. Presidiu o julgamento o Ministro Ricardo Lewandowski. Plenário, 19.03.2015.","DIREITO ADMINISTRATIVO E OUTRAS MATÉRIAS DE DIREITO PÚBLICO","1 - DIREITO ADMINISTRATIVO E OUTRAS MATÉRIAS DE DIREITO PÚBLICO | SERVIDOR PÚBLICO CIVIL | SISTEMA REMUNERATÓRIO E BENEFÍCIOS | GRATIFICAÇÃO INCORPORADA / QUINTOS E DÉCIMOS / VPNI","0","0"
"Rcl-5826","Rcl",5826,2008,"MIN. CÁRMEN LÚCIA","18/3/2015","Improcedente","Decisão: O Tribunal, por maioria, julgou improcedente a reclamação, vencida a Ministra Cármen Lúcia (Relatora) e parcialmente vencido o Ministro Ayres Britto. O Tribunal rejeitou a proposta do Ministro Marco Aurélio, no que foi acompanhado pela Ministra Cármen Lúcia, de conversão do julgamento em diligência. O Ministro Marco Aurélio concedia habeas corpus de ofício. Não votaram, no mérito, os Ministros Roberto Barroso e Rosa Weber por sucederem, respectivamente, aos Ministros Ayres Britto e Ellen Gracie. Por indicação do Ministro Celso de Mello, a Corte decidiu que redigirá o acórdão o Ministro Dias Toffoli. Presidiu o julgamento o Ministro Ricardo Lewandowski. Plenário, 18.03.2015.","DIREITO DO TRABALHO","1 - DIREITO DO TRABALHO | CATEGORIA PROFISSIONAL ESPECIAL | ADVOGADOS","0","0"
"Rcl-8853","Rcl",8853,2009,"MIN. CÁRMEN LÚCIA","18/3/2015","Improcedente","Decisão: O Tribunal, por maioria, julgou improcedente a reclamação, vencida a Ministra Cármen Lúcia (Relatora) e parcialmente vencido o Ministro Ayres Britto. O Tribunal rejeitou a proposta do Ministro Marco Aurélio, no que foi acompanhado pela Ministra Cármen Lúcia, de conversão do julgamento em diligência. O Ministro Marco Aurélio concedia habeas corpus de ofício. Não votaram, no mérito, os Ministros Roberto Barroso e Rosa Weber por sucederem, respectivamente, aos Ministros Ayres Britto e Ellen Gracie. Por indicação do Ministro Celso de Mello, a Corte decidiu que redigirá o acórdão o Ministro Dias Toffoli. Presidiu o julgamento o Ministro Ricardo Lewandowski. Plenário, 18.03.2015.","DIREITO PROCESSUAL PENAL","1 - DIREITO PROCESSUAL PENAL | PRISÃO DOMICILIAR / ESPECIAL","0","0"
"ADI-2615","ADI",2615,2002,"MIN. EROS GRAU","11/3/2015","Procedente","Decisão: Colhidos os votos da Ministra Rosa Weber e do Ministro Celso de Mello, o Tribunal, por maioria, julgou procedente o pedido formulado na ação direta para declarar a inconstitucionalidade da Lei nº 11.908/2001, do Estado de Santa Catarina, vencido o Ministro Ayres Britto. Não votaram os Ministros Roberto Barroso, Teori Zavascki, Luiz Fux e Ricardo Lewandowski, por sucederem, respectivamente, aos Ministros Ayres Britto, Cezar Peluso, Eros Grau (Relator) e Carlos Velloso. Ausentes, neste julgamento, os Ministros Marco Aurélio, Gilmar Mendes e Dias Toffoli, estes dois últimos com votos proferidos em assentada anterior. Presidiu o julgamento o Ministro Ricardo Lewandowski. Plenário, 11.03.2015.","DIREITO DO CONSUMIDOR","1 - DIREITO DO CONSUMIDOR | CONTRATOS DE CONSUMO | TELEFONIA | ASSINATURA BÁSICA MENSAL","0","0"
"RE-586224","RE",586224,2008,"MIN. LUIZ FUX","9/3/2015","Julgado mérito de tema com repercussão geral","NA SESSÃO DO PLENÁRIO DE 5.3.2015 (ÀS 14 HS)Decisão: O Tribunal, decidindo o tema 145 da Repercussão Geral, por maioria, vencida a Ministra Rosa Weber, deu provimento ao recurso extraordinário para declarar a inconstitucionalidade da Lei nº 1.952, de 20 de dezembro de 1995, do Município de Paulínia/SP. Por unanimidade, o Tribunal firmou a tese de que o município é competente para legislar sobre o meio ambiente com a União e Estado, no limite do seu interesse local e desde que tal regramento seja harmônico com a disciplina estabelecida pelos demais entes federados (art. 24, inciso VI, c/c 30, incisos I e II, da Constituição Federal). Presidiu o julgamento o Ministro Ricardo Lewandowski. Plenário, 05.03.2015.","DIREITO ADMINISTRATIVO E OUTRAS MATÉRIAS DE DIREITO PÚBLICO","0 - DIREITO ADMINISTRATIVO E OUTRAS MATÉRIAS DE DIREITO PÚBLICO | CONTROLE DE CONSTITUCIONALIDADE | INCONSTITUCIONALIDADE MATERIAL 1 - DIREITO ADMINISTRATIVO E OUTRAS MATÉRIAS DE DIREITO PÚBLICO | MEIO AMBIENTE","0","0"
"HC-84548","HC",84548,2004,"MIN. MARCO AURÉLIO","4/3/2015","Concedida em parte a ordem","Decisão: O Tribunal, por maioria, concedeu em parte a ordem apenas para revogar o decreto de prisão preventiva, vencidos parcialmente os Ministros Cezar Peluso, Cármen Lúcia e Ayres Britto, que denegavam a ordem, e o Ministro Marco Aurélio (Relator), que a implementava em maior extensão. Não votaram os Ministros Roberto Barroso, Teori Zavascki e Dias Toffoli por sucederem, respectivamente, aos Ministros Ayres Britto, Cezar Peluso e Sepúlveda Pertence. Redigirá o acórdão o Ministro Gilmar Mendes. Ausentes, nesta assentada, os Ministros Gilmar Mendes e Luiz Fux, que proferiram voto em assentadas anteriores. Presidiu o julgamento o Ministro Ricardo Lewandowski. Plenário, 04.03.2015.","DIREITO PROCESSUAL PENAL","1 - DIREITO PROCESSUAL PENAL | PRISÃO PREVENTIVA 2 - DIREITO PROCESSUAL PENAL | AÇÃO PENAL | NULIDADE | AUSÊNCIA DE FUNDAMENTAÇÃO","0","0"
"ADI-3477","ADI",3477,2005,"MIN. CEZAR PELUSO","4/3/2015","Procedente em parte","Decisão: O Tribunal, por maioria, julgou parcialmente procedente a ação, dando interpretação conforme para que o parágrafo único do artigo 3º da Lei nº 8.633/2005, do Estado do Rio Grande do Norte, seja interpretado à luz do § 21 do art. 40 da Constituição Federal, vencido o Ministro Cezar Peluso (Relator), que julgava parcialmente procedente a ação nos termos do seu voto. Não votou o Ministro Teori Zavascki por suceder ao Ministro Cezar Peluso (Relator). Redigirá o acórdão o Ministro Luiz Fux. Presidiu o julgamento o Ministro Ricardo Lewandowski. Plenário, 04.03.2015.","DIREITO TRIBUTÁRIO","1 - DIREITO TRIBUTÁRIO | CONTRIBUIÇÕES | CONTRIBUIÇÕES PREVIDENCIÁRIAS | SERVIDORES INATIVOS 2 - DIREITO ADMINISTRATIVO E OUTRAS MATÉRIAS DE DIREITO PÚBLICO | SERVIDOR PÚBLICO CIVIL | PENSÃO","0","0"
"RE-724347","RE",724347,2012,"MIN. MARCO AURÉLIO","26/2/2015","Julgado mérito de tema com repercussão geral","Decisão: O Tribunal, por maioria, vencidos os Ministros Marco Aurélio (Relator) e Luiz Fux, apreciando a tese 671 da repercussão geral, deu provimento ao recurso extraordinário, assentando-se a tese de que, na hipótese de posse em cargo público determinada por decisão judicial, o servidor não faz jus à indenização sob fundamento de que deveria ter sido investido em momento anterior, salvo situação de arbitrariedade flagrante. Redigirá o acórdão o Ministro Roberto Barroso. Ausente, justificadamente, o Ministro Dias Toffoli, participando do Congresso Internacional ¿Diálogos Judiciales en el Sistema Interamericano de Garantía de los Derechos Humanos¿, realizado em Barcelona, Espanha. Presidiu o julgamento o Ministro Ricardo Lewandowski. Plenário, 26.02.2015.","DIREITO ADMINISTRATIVO E OUTRAS MATÉRIAS DE DIREITO PÚBLICO","0 - DIREITO ADMINISTRATIVO E OUTRAS MATÉRIAS DE DIREITO PÚBLICO | RESPONSABILIDADE DA ADMINISTRAÇÃO | INDENIZAÇÃO POR DANO MATERIAL 1 - DIREITO ADMINISTRATIVO E OUTRAS MATÉRIAS DE DIREITO PÚBLICO | CONCURSO PÚBLICO / EDITAL | CLASSIFICAÇÃO E/OU PRETERIÇÃO","0","0"
"ADI-4900","ADI",4900,2013,"MIN. TEORI ZAVASCKI","11/2/2015","Procedente","Decisão: O Tribunal, por maioria, julgou procedente o pedido formulado na ação para declarar a inconstitucionalidade dos artigos 2º e 3º da Lei nº 11.905/2010, do Estado da Bahia, vencido, em parte, o Ministro Teori Zavascki, que apenas conferia interpretação conforme, sem redução de texto, ao art. 2º da referida lei, de forma a excluir de sua incidência os magistrados vinculados ao Tribunal de Justiça. Os Ministros Teori Zavascki (Relator), Dias Toffoli e Marco Aurélio não modularam os efeitos da decisão, não sendo atingido o quorum para este fim. Redigirá o acórdão o Ministro Roberto Barroso. Falou, pelo requerente, o Dr. José Saraiva, OAB/DF 6.242. Presidiu o julgamento o Ministro Ricardo Lewandowski. Plenário, 11.02.2015.","DIREITO ADMINISTRATIVO E OUTRAS MATÉRIAS DE DIREITO PÚBLICO","0 - DIREITO ADMINISTRATIVO E OUTRAS MATÉRIAS DE DIREITO PÚBLICO | CONTROLE DE CONSTITUCIONALIDADE | INCONSTITUCIONALIDADE MATERIAL 1 - DIREITO ADMINISTRATIVO E OUTRAS MATÉRIAS DE DIREITO PÚBLICO | SERVIDOR PÚBLICO CIVIL | SISTEMA REMUNERATÓRIO E BENEFÍCIOS | TETO SALARIAL 2 - DIREITO ADMINISTRATIVO E OUTRAS MATÉRIAS DE DIREITO PÚBLICO | SERVIDOR PÚBLICO CIVIL | SISTEMA REMUNERATÓRIO E BENEFÍCIOS | SUBTETO SALARIAL 3 - DIREITO ADMINISTRATIVO E OUTRAS MATÉRIAS DE DIREITO PÚBLICO | CONTROLE DE CONSTITUCIONALIDADE | PROCESSO LEGISLATIVO","0","0"
"ADI-4967","ADI",4967,2013,"MIN. LUIZ FUX","5/2/2015","Não conhecido(s)","Decisão: O Tribunal, por maioria e nos termos do voto do Relator, não conheceu da ação direta por falta de legitimidade ativa ad causam, vencido, em parte, o Ministro Marco Aurélio, que reconhecia a legitimidade apenas da Federação Nacional de Entidades de Oficiais Militares Estaduais - FENEME. Ausentes, justificadamente, o Ministro Roberto Barroso e, neste julgamento, o Ministro Gilmar Mendes. Presidiu o julgamento o Ministro Ricardo Lewandowski. Plenário, 05.02.2015.","DIREITO ADMINISTRATIVO E OUTRAS MATÉRIAS DE DIREITO PÚBLICO","1 - DIREITO ADMINISTRATIVO E OUTRAS MATÉRIAS DE DIREITO PÚBLICO | MILITAR | SISTEMA REMUNERATÓRIO E BENEFÍCIOS","0","0"
"ADI-2072","ADI",2072,1999,"MIN. CÁRMEN LÚCIA","4/2/2015","Procedente em parte","Decisão: O Tribunal, por maioria e nos termos do voto da Relatora, julgou parcialmente procedente a ação direta para declarar a inconstitucionalidade do art. 2º da Lei nº 11.367/1999, do Estado do Rio Grande do Sul; prejudicada a ação quanto aos artigos 3º e 4º e improcedente quanto aos artigos 1º, 5º e 6º, todos da Lei nº 11.367/1999, do Estado do Rio Grande do Sul, vencidos, em parte, os Ministros Marco Aurélio e Luiz Fux, que a julgavam integralmente procedente. Ausentes, justificadamente, os Ministros Celso de Mello e Roberto Barroso. Presidiu o julgamento o Ministro Ricardo Lewandowski. Plenário, 04.02.2015.","DIREITO ADMINISTRATIVO E OUTRAS MATÉRIAS DE DIREITO PÚBLICO","1 - DIREITO ADMINISTRATIVO E OUTRAS MATÉRIAS DE DIREITO PÚBLICO | CONTROLE DE CONSTITUCIONALIDADE | PROCESSO LEGISLATIVO 2 - DIREITO ADMINISTRATIVO E OUTRAS MATÉRIAS DE DIREITO PÚBLICO | ORÇAMENTO","0","0"
"AR-1699","AR",1699,2002,"MIN. MARCO AURÉLIO","18/12/2014","Improcedente","Decisão: O Tribunal, por maioria e nos termos do voto do Ministro Marco Aurélio (Relator), julgou improcedente a ação, vencidos os Ministros Ricardo Lewandowski (Revisor) e Roberto Barroso. Ausentes, justificadamente, os Ministros Gilmar Mendes e Cármen Lúcia. Falou, pelos réus, o Dr. José Carlos Barbosa Neto, OAB/RJ 86.310. Presidiu o julgamento o Ministro Ricardo Lewandowski. Plenário, 18.12.2014.","DIREITO ADMINISTRATIVO E OUTRAS MATÉRIAS DE DIREITO PÚBLICO","1 - DIREITO ADMINISTRATIVO E OUTRAS MATÉRIAS DE DIREITO PÚBLICO | CONCURSO PÚBLICO / EDITAL","0","0"
"RE-591054","RE",591054,2008,"MIN. MARCO AURÉLIO","17/12/2014","Julgado mérito de tema com repercussão geral","Decisão: O Tribunal, decidindo o tema 129 da Repercussão Geral, por maioria e nos termos do voto do Relator, negou provimento ao recurso extraordinário, vencidos os Ministros Ricardo Lewandowski (Presidente), Rosa Weber, Luiz Fux e Cármen Lúcia, firmando-se a tese de que a existência de inquéritos policiais ou de ações penais sem trânsito em julgado não pode ser considerada como maus antecedentes para fins de dosimetria da pena. Ausente, justificadamente, o Ministro Luiz Fux, que proferiu voto em assentada anterior. Presidiu o julgamento o Ministro Ricardo Lewandowski. Plenário, 17.12.2014.","DIREITO PENAL","1 - DIREITO PENAL | PARTE GERAL | APLICAÇÃO DA PENA","0","0"
"RvC-5437","RvC",5437,2014,"MIN. TEORI ZAVASCKI","17/12/2014","Procedente em parte","Decisão: O Tribunal, por maioria e nos termos dos votos do Relator e do Revisor, julgou parcialmente procedente a revisão criminal, vencidos, em menor extensão, os Ministros Cármen Lúcia, Gilmar Mendes e Celso de Mello. O Ministro Marco Aurélio, que acompanhou o Relator, assentou a incompetência do Supremo Tribunal Federal para julgar o réu, em face da renúncia, e anulou a dosimetria da pena, também afastando o ressarcimento dos danos com fundamento no art. 387 do Código de Processo Penal. Ausentes, justificadamente, o Ministro Luiz Fux, e, neste julgamento, o Ministro Dias Toffoli. Falou, pelo requerente, o Dr. Antônio Nabor Areias Bulhões, OAB/DF 1465-A. Presidiu o julgamento o Ministro Ricardo Lewandowski. Plenário, 17.12.2014.","DIREITO PROCESSUAL PENAL","0 - DIREITO PROCESSUAL PENAL | JURISDIÇÃO E COMPETÊNCIA1 - DIREITO PROCESSUAL PENAL | AÇÃO PENAL | NULIDADE","0","0"
"ADI-3169","ADI",3169,2004,"MIN. MARCO AURÉLIO","11/12/2014","Procedente","Decisão: O Tribunal, por maioria, julgou procedente a ação direta para declarar a inconstitucionalidade da Lei nº 10.877, de 10 de setembro de 2001, do Estado de São Paulo, vencidos os Ministros Marco Aurélio (Relator) e Luiz Fux, que a julgavam improcedente. Redigirá o acórdão o Ministro Roberto Barroso. Ausentes, justificadamente, o Ministro Ricardo Lewandowski (Presidente), em viagem à Itália para participar da ""101ª Sessão Plenária da Comissão de Veneza"", e, neste julgamento, o Ministro Dias Toffoli. Presidiu o julgamento a Ministra Cármen Lúcia (Vice-Presidente). Plenário, 11.12.2014.","DIREITO ADMINISTRATIVO E OUTRAS MATÉRIAS DE DIREITO PÚBLICO","1 - DIREITO ADMINISTRATIVO E OUTRAS MATÉRIAS DE DIREITO PÚBLICO | SERVIÇOS | CONCESSÃO / PERMISSÃO / AUTORIZAÇÃO | TRANSPORTE TERRESTRE","0","0"
